Category,EPM Feature,Feature Description,In Use Today,Avecto,Intune EPM,CyberArk EPM,Notes
Privilege Elevation,Remove local admin rights,"Removes standing administrator privileges from end users, enforcing least privilege by default",True,Yes,Yes,Yes,All platforms support
Privilege Elevation,Automatic/silent elevation,Elevates approved applications automatically without user interaction or prompts,True,Yes,Yes,Yes,Policy-based
Privilege Elevation,User self-service elevation,"Allows users to request elevation themselves with business justification, without IT ticket",True,Yes,Yes,Yes,With justification
Privilege Elevation,Helpdesk/admin approval,Elevation requests routed to helpdesk or admin for manual approval via console,True,Yes,Yes,Yes,Console-based
Privilege Elevation,Business justification capture,Captures and stores user-provided reason for why elevation is needed,True,Yes,Yes,Yes,Free text or forms
Privilege Elevation,Challenge/response codes,One-time codes generated by admin and provided to user for temporary elevation,False,Yes,No,Yes,Gap: Intune lacks this
Approval Workflows,Manager approval chain,Routes elevation requests to user's manager for approval before granting access,False,Yes,No,Yes,Gap: Intune requires custom dev
Approval Workflows,Multi-level approval,"Requires multiple approvers (e.g., manager then security) before elevation granted",False,Yes,No,Yes,Gap: Intune lacks this
Approval Workflows,Emergency break-glass,Emergency override mechanism for urgent access when normal approval unavailable,False,Yes,No,Yes,Gap: Intune lacks this
Approval Workflows,Mobile approval,Approvers can approve/deny requests via mobile app without console access,False,No,No,Yes,CyberArk advantage
Approval Workflows,Auto-escalation,Automatically escalates unanswered requests to backup approver after timeout,False,Yes,No,Yes,Gap: Intune lacks this
Time Controls,Session duration limits,Configurable time limit for how long elevated privileges remain active,True,Yes,Yes,Yes,All platforms support
Time Controls,Auto-revoke on timeout,Automatically removes elevated privileges when session timer expires,False,Yes,Yes,Yes,Available but not used
Time Controls,Time-of-day restrictions,"Restricts when elevation can be requested (e.g., business hours only)",False,Yes,No,Yes,Gap: Intune lacks this
Time Controls,Session extension without re-approval,Users can extend active session without going through full approval again,False,No,No,Yes,CyberArk advantage
Application Control,Application whitelisting,Only explicitly approved applications can run; all others blocked by default,True,Yes,Yes*,Yes,Intune requires WDAC
Application Control,Application blacklisting,Specific applications explicitly blocked from running regardless of user,True,Yes,Yes*,Yes,Intune requires WDAC
Application Control,Greylisting/restricted mode,Unknown applications run in restricted sandbox with limited system access,False,Yes,No,Yes,Gap: Intune lacks this
Application Control,Sandboxing,Isolates untrusted content/applications in secure container to prevent system damage,True,Yes,No,Yes,Gap: Intune requires Zscaler
Policy & Targeting,User/group targeting,Policies applied based on Active Directory user accounts or security groups,True,Yes,Yes,Yes,All platforms support
Policy & Targeting,Device/computer targeting,"Policies applied based on device name, OU, or device group membership",True,Yes,Yes,Yes,All platforms support
Policy & Targeting,Application-specific rules,Different elevation rules for different applications based on risk profile,True,Yes,Yes,Yes,All platforms support
Policy & Targeting,Location/network-based,"Policies vary based on user location, IP address, or network zone",False,Limited,Yes*,Yes,Intune via Conditional Access
Policy & Targeting,Risk-based policies,Dynamic policies that adjust based on real-time risk score of user/device,False,No,Yes*,Yes,Intune via Entra ID signals
Audit & Compliance,Full elevation audit trail,"Complete log of all elevation requests, approvals, denials, and actions taken",True,Yes,Yes,Yes,All platforms support
Audit & Compliance,Approver identity logging,Records who approved each elevation request for accountability,True,Yes,Yes,Yes,All platforms support
Audit & Compliance,SIEM integration,Sends elevation events to Security Information and Event Management platform,True,Yes,Yes,Yes,All platforms support
Audit & Compliance,Compliance report templates,"Pre-built reports for SOX, PCI, HIPAA and other compliance frameworks",False,Limited,No,Yes,CyberArk advantage
Audit & Compliance,Session recording,Video-like recording of all actions performed during elevated session,False,No,No,Yes,CyberArk advantage
Platform Support,Windows 10/11,Agent support for Windows 10 and Windows 11 workstations,True,Yes,Yes,Yes,All platforms support
Platform Support,Windows Server,"Agent support for Windows Server editions (2016, 2019, 2022)",True,Yes,No,Yes,Gap: Intune lacks this
Platform Support,macOS,Agent support for Apple macOS endpoints,False,Yes,Roadmap,Yes,Gap: Intune not yet available
Platform Support,Linux,"Agent support for Linux distributions (RHEL, Ubuntu, etc.) with sudo management",False,Limited,No,Yes,Gap: Intune lacks this
Integration,ServiceNow/ITSM native,Built-in integration with ServiceNow or other ITSM for ticket creation,False,Yes,No,Yes,Gap: Intune requires custom dev
Integration,Microsoft ecosystem,"Native integration with Intune, Entra ID, Defender, and other Microsoft tools",True,Limited,Yes,Yes,Intune advantage
Integration,PAM integration,Integration with Privileged Access Management vault for credential checkout,False,BeyondTrust,,Native,CyberArk advantage
Threat Protection,Credential theft protection,Detects and blocks attempts to steal cached or stored credentials,False,Limited,No*,Yes,Intune relies on Defender
Threat Protection,Ransomware protection,Advanced controls to detect and block ransomware execution patterns,False,Limited,No*,Yes,Intune relies on Defender
Threat Protection,Privilege deception,Deploys fake credentials as lures to detect lateral movement attempts,False,No,No,Yes,CyberArk unique
